title,link,number_of_citation,article_type,publisher,keyword,abstract,publish_date,publication_title,authors,affiliations,countries
A Cluster-Based Routing Protocol for Wireless Sensor Networks-Based IoT System,https://link.springer.com/chapter/10.1007/978-981-99-7077-3_49,none,conference,Springer,none,"A cluster-based routing protocol for Internet of Things (IoT) network which is based on wireless sensor networks has been proposed in this paper. The basic clustering approach is adopted from the well-known Hybrid Energy Efficient Distributed (HEED) clustering protocol. This work mainly focuses on the data forwarding model through which data originated at source node can reach the base station, which is the destination. The intermediate sensor nodes are considered to be static in nature. Achieving energy efficiency being the primary objective, the protocol follows a cluster-based hierarchical data delivery model. The proposed protocol achieves energy efficiency. Simulation results depicting the performance of the proposed protocol have been reported. Future scopes of the work have also been outlined.",28 January 2024,"Innovations in VLSI, Signal Processing and Computational Technologies","Irak Rigia,Bhaskar Bhuyan,Rajdeep Chakraborty,Hiren Kumar Deva Sarma","(Department of IT,Sikkim Manipal Institute of Technology,Rangpo,Sikkim,737136,India),(Department of CSE,Chandigarh University,Chandigarh,Punjab,140413,India),(Department of IT,Gauhati University,Guwahati,Assam,781014,India)","India,India,India"
Towards Intra-cluster Data Prediction in IoT for Efficient Energy Consumption,https://link.springer.com/chapter/10.1007/978-3-031-47126-1_6,none,conference,Springer,none,"Optimization of energy consumption in Internet of Things (IoT) Wireless Network and routing of payload data are major concerns. In this chapter, we combine several machine learning algorithms to address these issues. The proposed sequential approach is based on two algorithms. First, we put forward the Density-Based Spatial Clustering of Applications with Noise (DBSCAN), in which IoT nodes are grouped into clusters. Second, we built an intra-cluster prediction model based on multiple linear regression, in which the cluster head (CH) predicts the next information of each cluster member. This helps to limit the communication between CH and members and thus reduce the network energy consumption. Third, we performed CH selection according to its residual energy, the distance from the base station, and the base station and the number of cluster members. Simulations and a comparative study have been carried out to prove the relevance of the proposed method. From experimental analyses, we found that the proposed method increases network lifetime by a factor of 13.16, 28.75, and 47.66 as compared to LEACH, k-means-SDR, and DBSCAN-SDR approaches, respectively.",20 December 2023,"The 6th International Conference on Wireless, Intelligent and Distributed Environment for Communication","Arouna Ndam Njoya,Innocent Emmanuel Batouri Maidadi,Ado Adamou Abba Ari,Ado Adamou Abba Ari,Wahabou Abdou,Sondes Khemiri Kallel,Abdelhak Mourad Gueroui,Ousmane Thiare,Emmanuel Tonye","(Department of Computer Engineering,University Institute of Technology,University of Ngaoundéré,Ngaoundéré,Cameroon),(DAVID Lab,Université Paris-Saclay,University of Versailles Saint-Quentin-en-Yvelines,Versailles,France),(LaRI Lab,University of Maroua,Maroua,Cameroon),(LIB EA7534,University Bourgogne Franche-Comté,Dijon,France),(DAVID Lab,Université Paris-Saclay,University of Versailles Saint-Quentin-en-Yvelines,Versailles,France),(LRI Lab,Gaston Berger University of Saint-Louis,Saint-Louis,Senegal),(Department of Electrical Engineering and Telecommunications,National Advanced School of Engineering of Yaoundé,University of Yaoundé 1,Yaoundé,Cameroon)","Cameroon,Cameroon,Cameroon,France,France,France,Senegal"
"A Survey of Energy Conservation, Routing and Coverage in Wireless Sensor Networks",https://link.springer.com/chapter/10.1007/978-3-642-23620-4_10,5,conference,Springer,none,"The emergence of multimedia wireless sensor networks and its characteristics bring in new problems of wireless sensor networks compared with the traditional networks and wireless networks. We mainly consider three issues in this paper, energy conservation, coverage and efficient routing, all of which are fundamental in designing and implementation of wireless sensor networks. Energy conservation is the most significant problem in wireless sensor networks due to its limited energy source intuitively. The other two issues are usually combined with the energy conservation problem. The goal of coverage requirement is to have each location in the targeted physical space within sensing range of at least one sensor node. Besides, efficient routing aims to solve the problem that the collected data are efficiently reported to end-users. We introduce several state-of-the-art works and conclude these researches concerning their various metrics. Finally, we propose some rules while designing the wireless sensor networks according to the previous works, concerning these metrics.",2011,Active Media Technology,"Wang Bin,Li Wenxin,Li Liu","(Lanzhou Physical Institute,Lanzhou,Gansu,730000,P.R. China),(School of Information Science and Engineering,Lanzhou University,Lanzhou,Gansu,730000,P.R. China)","China,China"
Energy Efficient MAC Protocol for Wireless Sensor Networks: A Survey,https://link.springer.com/chapter/10.1007/978-3-319-68505-2_36,none,conference,Springer,none,"Wireless Sensor Networks (WSNs) has gained tremendous popularity in various practical applications, in which sensors are fundamentally battery-powered and significantly resource-limited. Well-designed Medium Access Control (MAC) protocols can make great contribution on the performance of the networks. In this paper, we present a survey on some typical or newly proposed MAC protocols which aims at enhancing energy efficiency of the networks. The classification and beneficial characteristics of MAC protocols are discussed. Furthermore, we analyze the protocols’ performance in various fields, and point out the open research issue.",31 October 2017,Cloud Computing and Security,"Zichun Wang,Meng Feng,Tiantian Miao,Wei Jiang,Jian Shen","(School of Computer and Software,Nanjing University of Information Science and Technology,Nanjing,210044,China)",China
Increasing Intelligent Wireless Sensor Networks Survivability by Applying Energy-Efficient Schemes,https://link.springer.com/chapter/10.1007/0-387-34224-9_77,3,conference,Springer,none,"Intelligent Energy efficiency is an important research topic for ad-hoc Wireless Sensor Networks (WSN). Power saving makes it possible to guarantee basic levels of system performance, such as connectivity, throughput and delay, in the presence of both mobility-immobility and a large number of sensor nodes. A large variety of approaches for intelligent energy-efficient schemes have been proposed in the literature focusing on different performance metrics. This article presents a comprehensive survey of recent energy-efficient schemes in ad-hoc wireless sensor networks, the application of which increases nodes’ lifetime and thus, network connectivity and survivability.",2006,Artificial Intelligence Applications and Innovations,"Nikolaos A. Pantazis,Dimitrios J. Vergados,Dimitrios D. Vergados,Dimitrios J. Vergados","(Department of Information and Communication Systems Engineering,University of the Aegean,GR-83200,Karlovassi,Samos,Greece),(School of Electrical and Computer Engineering,National Technical University of Athens,Iroon Polytexneiou 9,GR-157 73,Zografou,Athens,Greece)","Greece,Greece"
Energy Efficient Multipath Routing in Large Scale Sensor Networks with Multiple Sink Nodes,https://link.springer.com/chapter/10.1007/11573937_42,16,conference,Springer,none,"Due to the battery resource constraint, it is a critical issue to save energy in wireless sensor networks, particularly in large sensor networks. One possible solution is to deploy multiple sink nodes simultaneously. In this paper, we propose a protocol called MRMS (Multipath Routing in large scale sensor networks with Multiple Sink nodes) which incorporates multiple sink nodes, a new path cost metric for improving path selection, dynamic cluster maintenance and path switching to improve energy efficiency. MRMS is shown to increase the lifetime of sensor nodes substantially compared to other algorithms based on a series of simulation experiments.",2005,Advanced Parallel Processing Technologies,"Yuequan Chen,Edward Chan,Song Han","(Department of Computer Science,City University of Hong Kong, )",
SLEDS: A DSL for Data-Centric Storage on Wireless Sensor Networks,https://link.springer.com/chapter/10.1007/978-3-030-11238-7_5,none,conference,Springer,none,"The dynamicity requirements of urban sensor networks rise new challenges to the development of data management and storage models. Software component techniques allow developers to build a software system from reusable, existing components sharing a common interface. Moreover, the development of urban sensor networks applications would greatly benefit from the existence of a dedicated programming environment. This paper proposes SLEDS, a Domain-Specific Language for Data-Centric Storage on Wireless Sensor Networks. The language includes high-level composition primitives, to promote a flexible coordination execution flow and interaction between components. We present the language specification as well as a case study of data storage coordination on sensor networks. The current specification of the language generates code for the NS2 simulation environment. The case study shows that the language implements a flexible model, which is general enough to be used on a wide variety of sensor network applications.",23 January 2019,Big Social Data and Urban Computing,"Marcos Aurélio Carrero,Aldri Luiz dos Santos,Carmem S. Hara,Martin A. Musicante,Marcos Aurélio Carrero","(Universidade Federal do Paraná,Curitiba,Brazil),(Universidade Federal do Rio Grande do Norte,Natal,Brazil),(FAE Centro Universitário – Paraná,Curitiba,Brazil)","Brazil,Brazil,Brazil"
OSEP: An Optimized Stable Election Protocol in Heterogeneous Wireless Sensor Networks,https://link.springer.com/chapter/10.1007/978-981-15-8297-4_20,2,conference,Springer,none,"The wireless sensor networks (WSNs) are attracting researchers because of their extensive variety of applications in different aspects. They perform monitoring responsibility in all kinds of the environment including harsh environments. Thus, a stable network is required for gathering data for a long duration from the monitoring areas. This constancy of the networks depends on the load balancing among the deployed nodes. The stability of networks can be enlarged by the clustering which executes a commanding role in the effective exploitation of energy degeneracy of their batteries and assistances in extending the network lifespan. The communication among the nodes and sink is consumed the highest energy which requires a procedure that can decrease the communication cost. In this paper, we deliberate an enhanced stable election protocol for improving the lifecycle of the heterogeneous WSNs. In the optimization of SEP protocol, three parameters are considered for effective cluster heads selection, namely the nodes remaining energy, node distance from the base station, and total network energy. In this methodology, a threshold-based formula is proposed which considers a different type of energies of the networks such as current energy of the networks, and preliminary and residual energy of the nodes which provides even load balancing. The proposed method contributes a dynamic clustering to lowering energy consumption and avoiding the load over the cluster heads. The number of active and dead, the sum of energy depletion, and the number of messages transferred to the control node matrices are considered to examine the enactment of the proposed scheme by using the MATLAB. After comprehensive analysis, it has been evident that the projected scheme accomplishes superior to that of the existing methods.",13 January 2021,Recent Innovations in Computing,"Samayveer Singh,Aruna Malik,Pradeep Kumar Singh","(Department of Computer Science & Engineering,Dr B R Ambedkar National Institute of Technology Jalandhar,Jalandhar,Punjab,India),(Department of Computer Science & Engineering,ABES Engineering College,Ghaziabad,Uttar Pradesh,India)","India,India"
Design Approach of Self-Organized Routing Protocol in Wireless Sensor Networks Using Biologically Inspired Methods,https://link.springer.com/chapter/10.1007/978-81-322-1823-4_19,none,conference,Springer,none,"Wireless sensor networks are composed of a large number of nodes equipped with radios for wireless communication, sensors for sensing the environment, and CPU’s for processing applications and protocols. A significant number of wireless sensor networks consist of battery-powered nodes to be able to operate unattended. Such networks require autonomy of management (self-organization), robustness, scalability, fault tolerance, and energy efficiency in all aspects of their operation. These properties are especially important for routing, since multi-hop communication is a primitive wireless sensor network operation that is robust, scalable, and adaptive with fault-prone as well as energy intensive. The objective is to design the routing protocol for robustness in self-organization in wireless sensor networks. In this paper, we try to design the novel architecture of robustness in self-organization with the consideration of three different bioinspired methods, i.e., BeeSensor, self-organized data gathering scheme (SDG), and AntHocnet for comparative study.",01 January 2014,Proceedings of Ninth International Conference on Wireless Communication and Sensor Networks,"A. N. Thakare,L. G. Malik","(G. H. Raisoni College of Engineering,Nagpur,India)",India
Adaptive Data Aggregation for Clustered Wireless Sensor Networks,https://link.springer.com/chapter/10.1007/978-3-540-73549-6_47,1,conference,Springer,none,"Wireless sensor network (WSN) has emerged as an event-driven paradigm based on the collective effort of numerous sensing nodes. Due to the dynamic topology and random deployment, incorporating adaptive behavior into protocols in WSNs is important. Hence, we propose an adaptive data aggregation (ADA) scheme for the clustered WSNs. In ADA scheme, the temporal aggregation degree controlled by the reporting frequency at sensor nodes and the spatial aggregation degree controlled by the aggregation degree at Cluster Heads (CHs) are determined by the current scheme state according to the observed reliability. Furthermore, the ADA scheme is mainly performed at the sink node, with a few functions at CHs and sensor nodes. Performance results show that the scheme state converges to the desired reliability starting from any initial state.",2007,Ubiquitous Intelligence and Computing,"Huifang Chen,Huifang Chen,Hiroshi Mineno,Tadanori Mizuno,Yoshitsugu Obashi,Tomohiro Kokogawa","(Dept. of Information Science and Electronic Engineering,Zhejiang University,No. 38,Zheda Road,Hangzhou 310027,P.R. China),(Dept. of Computer Science,Shizuoka University,3-5-1 Johoku,Hamamatsu,Shizuoka 432-8011,Japan),(NTT Service Integration Lab.,NTT Corporation,3-9-11 Midori,Musashino,Tokyo 180-8585,Japan)","China,Japan,Japan"
Packet Delivery Comparison Using Artificial Bee Colony Algorithm with Dynamic Technique,https://link.springer.com/chapter/10.1007/978-981-19-5403-0_8,none,conference,Springer,none,"Clustering is an excellent strategy to create a better path that does not cause any difficulties while sending data and the artificial bee colony algorithm may be an efficient optimisation method for the acquisition model of bees. In this paper, the dynamic technique has been used with an artificial bee colony. This technology makes packet delivery faster. The packet delivery is fast as compared to TORA LEACH and INSENS. Packet delivery comparison has been done using an artificial bee colony algorithm with a dynamic technique. It has been seen that due to the use of this technology, packet distribution has happened at a very fast speed. Whereas the packet delivery speeds of other technology are very less.",29 November 2022,Human-Centric Smart Computing,"Mirza Samiulla Beg,Akhilesh A. Waoo","(Department of Computer Science & IT,AKS University,Satna,Madhya Pradesh,India)",India
A Framework for Enhancing Network Lifetime in Internet of Things Environment Using Clustering Formation,https://link.springer.com/chapter/10.1007/978-981-16-2183-3_39,none,conference,Springer,none,"Internet of Things (IoT) is one of the current technology that gains the highest acceptance from various industries and academia nowadays. The growth of this technology has streamlined the day-to-day activities of individuals. It can be stated that day-to-day activities in the industries without the aid of the IoT is becoming harder and harder due to the manual process. This study investigates the issues of energy consumption in the IoT environment due to denial of service (DoS) attack in the IoT environment. Besides, a solution that remedies the issues is proposed in this study. The contributions of this study are categorized into two aspects. Firstly, the study described the components of the IoT, which includes the sensor nodes. Secondly, the study emphasizes in improving the energy of the nodes to enhance the network lifetime in the IoT environment. To achieve the milestone the study was implemented using MATLAB, and thereby considering the enabling technology such as wireless sensor network (WSN) and the RFID in the perception layer of IoT. The results reveal that the network lifetime has improved significantly with about 6% improvements as compared with security-based modified LEACH (MS-LEACH).",14 November 2022,International Conference on Artificial Intelligence for Smart Community,"Abdulrahman Aminu Ghali,Rohiza Ahmad,Hitham Alhussian","(Computer and Information Sciences Department,Universiti Teknologi PETRONAS,32610,Seri Iskandar,Perak Darul Ridzuan,Malaysia)",Malaysia
An SDN-Based Strategy for Reliable Data Transmission in Mobile Wireless Sensor Networks,https://link.springer.com/chapter/10.1007/978-3-030-19562-5_9,1,conference,Springer,none,"Wireless sensor networks have enormous applications in today’s world and have much more applications in near future. Wireless sensor networks are less reliable than other traditional networks due to its low power capabilities, limited energy, and other resources. Several applications of wireless sensor networks specifically in the context of hazardous scenarios where the wireless channel is in deprived state and that carry very critical data which need to be delivered to the designated destination with minimal delay and at right time demands a highly reliable network. To achieve better reliability wireless mobile networks could be employed. This paper proposes a novel fidelity model for a hazardous environment where the wireless channel is in deprived condition and early energy exhaustion is a threat by utilizing mobile nodes. The mobility of the node reduces the number of hops and thus increases the likelihood of effective transmissions. The simulations have proven better utilization of energy and the proposed methodology outperforms with other traditional methods in achieving reliability with minimal delay and minimal energy utilization.",19 October 2019,EAI International Conference on Big Data Innovation for Sustainable Cognitive Computing,"V. Shubha Rao,M. Dakshayini","(Department of Computer Science and Engineering,BMS College of Engineering,Bangalore,India),(Department of Information Science and Engineering,BMS College of Engineering,Bangalore,India)","India,India"
Effective Centralized Trust Management Model for Internet of Things,https://link.springer.com/chapter/10.1007/978-3-030-03493-1_6,none,conference,Springer,none,"The emergence of the Internet of Things (IoT) is a result of convergence between multiple technologies, like Internet, wireless communication, embedded systems, microelectronic systems and nanotechnology. In 2016, 5.5 million objects are connected every day in the world. A number that could quickly reach billions by 2020 [1]. Gartner predicts that 26 billion objects will be installed in 2020. The market for connected objects could range from a few tens of billions to up to several thousand billion units. Among the vital components of IoT, we find wireless sensor networks (WSNs). Wireless sensor networks as a vital component of the IoT, allow the representation of dynamic characteristics of the real world in the virtual world of the Internet. Nevertheless, the opening of these types of network to the Internet presents a serious problem stand point security. For that, the implementation of intrusion detection mechanisms is essential to limit the internal and external attacks that threaten the smooth running of the network. In this paper, we propose an efficient trust management model which seeks deeply through the nodes to detect attacks that threaten wireless sensor networks. Our model includes a geographical localization system used to identify the nodes location. Although, it includes a set of rules detection attacks based on different parameter analysis. Furthermore, we propose a mathematical model for trust establishment and its update on the network. During the simulations we observe an improvement of the efficiency of the implemented geo-location model and also a reasonable energy consumption. Similarly, we have been able to evince the efficiency of our model in terms of attacks detection rate.",09 November 2018,Intelligent Data Engineering and Automated Learning – IDEAL 2018,"Hela Maddar,Wafa Kammoun,Habib Youssef","(PRINCE Research Laboratory ISITCom,Sousse University,Hammam Sousse,Sousse,Tunisia)",Tunisia
Flower Pollination Optimization and RoI for Node Deployment in Wireless Sensor Networks,https://link.springer.com/chapter/10.1007/978-981-13-1742-2_17,1,conference,Springer,none,"Wireless Sensor Network (WSN) most popular area of research where lots of work done are in this field. Energy efficiency is one of the most focusing areas because the lifetime of the network is the most common issue. Many algorithms work for cluster and these algorithms form cluster either distance or neighbor node. In our study, we focus on node deployment approach and after that, we focus on routing algorithm. In the Wireless Sensor Network, the node placement is the essential part for the proper communication between the sensor nodes and Base Station (BS). For better communication nodes should be aware of their own or neighbor node’s location. Better optimization of resources and performance improvement are the main concern for the Wireless Sensor Network. Optimal techniques should be utilized to place the nodes at the best possible locations for achieving the desired goal. For node placement, flower pollination optimization is used to generate the better result. Base Station is responsible for the communication of nodes with each other and it should be reachable to nodes. For this Region of Interest (RoI) is helpful to choose the best location. Placement of Base Station in the middle is the suitable place for the static nodes deployment and there should be another strategy for the dynamic environment. Nodes should be connected to each other for the transmission of data from the source to Base Station properly. From the MATLAB simulation, it has been shown that the proposed methodology improves the network performance in terms of dead nodes, energy and the various packets sent to Base Station.",30 December 2018,Information and Communication Technology for Intelligent Systems,"Kapil Keswani,Anand Bhaskar","(Department of ECE,Sir Padampat Singhania University,Udaipur,India)",India
An Efficient and Secure Session Key Management Scheme for Cluster Based Wireless Sensors Networks,https://link.springer.com/chapter/10.1007/978-3-319-09265-2_5,1,conference,Springer,none,"Wireless Sensor Networks (WSNs) are often deployed in hostile environments, which make such networks highly vulnerable and increase the risk of attacks against this type of network. WSN comprises of large number of sensor nodes with different hardware abilities and functions. Due to the limited memory resources and energy constraints, complex security algorithms cannot be used in sensor networks. Therefore, it is necessary to well balance between the security level and the associated energy consumption overhead to mitigate the security risks. In this paper, we present an Efficient and Secure Session Key Management Scheme for Cluster-Based Wireless Sensors Networks (ESSKM). The proposed technique based on symmetric key mechanism, provides an improved session key establishment by updating periodically the session key within a cluster, hence avoids different type of attacks from malicious nodes and mitigates the node compromise attack. Finally, through the network simulator tool (NS-2), the security analysis and performance simulation demonstrate that ESSKM not only achieves efficient security, but also provides energy saving with low storage overhead.",2014,Pervasive Computing and the Networked World,"Abdoulaye Diop,Yue Qi,Qin Wang","(School of Computer and Communication Engineering,University of Science and Technology Beijing,Beijing,China)",China
