title,link,number_of_citation,article_type,publisher,keyword,abstract,publish_date,publication_title,authors,affiliations,countries
Efficient Energy Attentive and Fault Recognition Mechanism in Distributed Wireless Sensor Networks: A Review,https://link.springer.com/chapter/10.1007/978-3-030-16657-1_101,none,conference,Springer,none,"A recent modernization in wireless sensor networks (WSNs) has played a remarkable role to track and control the physical world. This technology is exhilarating with countless potential for many enormous applications like biomedical, industry, defence and so on. Despite of their benefits, design of energy attentive and fault recognition steering protocol is a key challenge. Plenty of research works has been proposed in past by many researchers based on multipath, query and location aware sensor network. However still there is a scope for enhancement in the performance of sensor network by finding efficient energy aware solution. Comprehensive analysis of existing methodologies in view of two challenges, energy management and fault recognition mechanism for scalable network is the main objective of this paper. This broad survey helps researchers to aware about technical concern and challenges in energy efficient fault recognition mechanism for WSNs.",12 April 2019,Intelligent Systems Design and Applications,"Roshani Talmale,M. Nirupama Bhat,Nita Thakare","(Vignan’s University,Deemed to be University,Vadalamudi,India),(Priyadarshini College of Engineering,Nagpur,India)","India,India"
Plus-Tree: A Routing Protocol for Wireless Sensor Networks,https://link.springer.com/chapter/10.1007/978-3-540-77368-9_62,8,conference,Springer,none,"We study tree-based routing protocols for wireless sensor networks. The existing tree-based algorithm has a few shortcomings; (1) it may take a long path since sensor node must transmit packets via either its parent or its children nodes and (2) it is vulnerable to a link failure since the tree has to be reconstructed in case of a single link failure. We propose Plus-Tree, a routing protocol, which overcomes the shortcomings and improves the performance of the existing protocol. A node in Plus-Tree may have neighbor links other than tree links that can be used for alternative path. Simulation results show that Plus-Tree performs better than the existing tree-based protocol with respect to hop counts.",2007,Advances in Hybrid Information Technology,"Yongsuk Park,Eun-Sun Jung","(Networking Technology Laboratory,Samsung Advanced Institute of Technology, )",
A Power Balance Control Strategy of Wireless Sensor Network with Collaborating Heuristic,https://link.springer.com/chapter/10.1007/978-981-33-6757-9_42,none,conference,Springer,none,"In order to effort a strong enough signal, nodes in wireless sensor networks (WSN) have to increase their transmission power that continues to maintain the transmission power. However, a vicious circle is iterated that causes a decline in the overall network performance, low utility, and network life cycle shorten. This paper presents a solution to the power balance control strategy for WSN with collaborating heuristic. A distance between the weight factors and obtained nodes interference value is used to establish a useful interference model for enhancing the signal-to-interference-noise ratio (SINR). The utility function of the nodes residual energy and transmission rate is modeled by apply heuristic strategy. The optimal transmission power is obtained after several iterations of the heuristic algorithm. Simulation results show that the proposed approach can prolong the network life cycle and achieve higher network utility.",21 April 2021,Advances in Intelligent Information Hiding and Multimedia Signal Processing,"Jie Yu,Thi-Kien Dao,Trong-The Nguyen,Truong-Giang Ngo,Trong-The Nguyen","(College of Mechanical and Automotive Engineering,Fujian University of Technology,Fuzhou,350118,China),(Fujian Provincial Key Laboratory of Big Data Mining and Applications,Fujian University of Technology,Fuzhou,China),(Faculty of Computer Science and Engineering,Thuyloi University,175 Tay Son,Dong Da,Hanoi,Vietnam),(Department of Information Technology,Haiphong University of Management and Technology,Haiphong,18000,Vietnam)","China,China"
Wireless Sensor Networks Based on Bio-Inspired Algorithms,https://link.springer.com/chapter/10.1007/978-3-319-95162-1_52,1,conference,Springer,none,"The goal of bio-inspired is to resolve human problems by studying and mimicking the characteristics of organisms or design elements which can be found in nature. Wireless sensor networks are used in a variety of fields but have limited network lifespans, so various research is being performed on the subject. In particular, research is being performed on observing and modeling the behavioral principles of various organisms to use in bio-inspired algorithms for efficient routing techniques in large-scale networks. In this research, we studied the pheromones used in ant communication and designed the techniques for energy efficiency improvement and traffic distribution by applying them to the proposed network. We designed biomimicry technology called the Wireless Sensor Networks Based on Bio-inspired Algorithms, and by analyzing and applying the similarities between communication systems and biological systems, our system was able to show improved performance in terms of extended network lifespan, optimized path selection, etc. In simulation results, the proposed routing algorithm has a short information collection time and low energy consumption, and through this it is able to maximize network energy efficiency.",04 July 2018,Computational Science and Its Applications – ICCSA 2018,"Meonghun Lee,Haengkon Kim,Hyun Yoe","(Department of Agricultural Engineering,NAAS,Jeonbuk,55365,Republic of Korea),(School of Information Technology Engineering,Catholic University of Daegu,Gyeongbuk,38430,Republic of Korea),(Department of Information and Communication Engineering,Sunchon National University,Jeonnam,57922,Republic of Korea)",
Degree of Proximity: A Novel Network Parameter to Maximize Lifetime of Wireless Sensor Networks Through Optimized Node Deployment,https://link.springer.com/chapter/10.1007/978-981-16-4369-9_40,none,conference,Springer,none,"Lifetime maximization of wireless sensor networks is a very prominent research topic. Different energy-efficient protocols have been proposed over the years for maximizing network lifetime. However, proposing an energy-efficient routing protocol alone is not enough to ensure prolonged lifetime of the network. Certain network parameters that can regulate energy consumption of a network too are required to be exploited for the purpose. Here, a novel network parameter called degree of proximity (DoP) has been proposed, and an optimum value of DoP was found, whereby one can maximize network lifetime with deployment of optimum number of nodes. This way, running cost of the network can be amortized. For the present work, we have considered both two- and three-dimensional wireless sensor networks where grid deployment of the nodes has been done.",07 December 2021,Advanced Computational Paradigms and Hybrid Intelligent Computing,"Kaushik Ghosh,Amitava Choudhury","(UPES,Dehradun,India)",India
Baud Rate-Based Hierarchical Multihop Routing Protocol for WSNs,https://link.springer.com/chapter/10.1007/978-981-15-2926-9_52,1,conference,Springer,none,"In wireless sensor networks (WSNs), the data sensed by the sensor node are forwarded to the sink node either by direct communication or by multihop communication. The disadvantage of direct communication is that the sensor nodes consume more energy to reach the sink node as each sensor node has to work alone to reach the sink node, and if the sink node is too far, condition gets worsens. Contrary to direct communication, the multihop communication saves energy as it forwards the data to the nearest neighbor node which in turn forwards the data toward the sink node. In multihop communication, choosing the best neighbor node for forwarding the data is the most challenging task. Hence, in this article, a novel hierarchical multihop routing protocol for WSNs referred to as “Baud Rate-Based Hierarchical Multihop Routing Protocol for WSNs” has been proposed which uses Shannon channel capacity model ‘C’ and neighbor node distance to choose the best neighbor node; the chosen neighbor node will be capable of transmitting data with high baud rate, thereby increasing the throughput of the network. Further, the proposed model also increases the lifetime of the network as the nearest neighbor node will be chosen for the data transfer which saves the energy of the sensor node. The proposed algorithm is compared against the LEACH routing protocol and multihop LEACH protocol and is implemented in MATLAB. The quantitative and qualitative analysis of the simulation results depicts that the proposed algorithm performs better against the parameters remaining energy of the sensor nodes, network lifetime, and data throughput when compared to LEACH and multihop LEACH protocols.
",29 April 2020,Optical and Wireless Technologies,"G. V. Sowmya,M. Kiran","(Jawaharlal Nehru National College of Engineering,Shimoga,Karnataka,India),(National Institute of Technology Karnataka,Suratkal,Mangalore,India)","India,India"
Hybrid Metaheuristic Algorithm-Based Clustering with Multi-Hop Routing Protocol for Wireless Sensor Networks,https://link.springer.com/chapter/10.1007/978-981-16-6285-0_65,3,conference,Springer,none,"Advancements in sensing and communication technologies resulted to the design of wireless sensor network (WSN) for low-cost distributed monitoring systems. Energy dissipation is a major problem in WSN. Clustering and routing are the familiar energy-efficient techniques offering several merits such as energy efficiency, network longevity, scalability, and less latency. Appropriate cluster heads (CHs) and optimal route selection processes can be assumed as the NP hard optimization problem and can be resolved by the use of metaheuristic algorithms. This paper presents a hybrid metaheuristic algorithm-based clustering with multi-hop routing (HMA-CMHR) protocol for WSN. The presented model incorporates different phases such as node initialization, clustering, routing, and data transmission. Firstly, the HMA-CMHR technique uses quantum harmony search algorithm (QHSA) based clustering process to elect an optimal subset of CHs. Secondly, the improved cuckoo search (ICS) algorithm based route technique is employed for an optimal selection of routes. The experimental results of the HMA-CMHR model are validated under different scenarios based on the number of nodes. An extensive experimental analysis is carried out to ensure the betterment of the HMA-CMHR method in terms of different measures. The experimental results showcased the superior performance of the HMA-CMHR technique over the compared methods in terms of distinct aspects.",22 November 2021,Proceedings of Data Analytics and Management,"S. Jagadeesh,I. Muthulakshmi","(Department of Computer Science and Engineering,V V College of Engineering,Tuticorin,Tamil Nadu,India)",India
Protocols for Network and Data Link Layer in WSNs: A Review and Open Issues,https://link.springer.com/chapter/10.1007/978-3-642-17878-8_55,2,conference,Springer,none,"Recent development in wireless sensor network (WSN) has shown the importance of routing protocols as they differ in application and networking architecture. The efficiency of WSNs strongly depends on the routing protocol used. In this paper, we have discussed some of the important protocols of network and data-link layer. Various issues such as energy efficiency, lifetime, scalability of network and mobility of nodes have been discussed here. The paper concludes with open research issues.",2011,Advances in Networks and Communications,"Ankit Jain,Deepak Sharma,Mohit Goel,A. K. Verma","(Computer Science and Engineering Department,Thapar University Patiala,Punjab,India)",India
Clustering Algorithm for 3D Wireless Mobile Sensor Network,https://link.springer.com/chapter/10.1007/978-3-319-23126-6_31,8,conference,Springer,none,"Scope of sensor networks is increasing every year, finding practical application in many areas of our lives. There are a lot of algorithms for organizing stationary sensor networks where nodes location does not change. Nowadays network nodes mobility is one of the basic properties for wireless sensor network. In this regard, there are some new problems, such as connecting nodes and optimizing their energy consumption, network coverage and others, which require a new approach to organizing sensor network algorithms. The appearance of flying sensor networks actualizes this task even more. This paper discusses problems associated with mobile wireless sensor networks implementation, proposes a new clustering algorithm for three-dimensional space, simulation and comparison with the LEACH-M algorithm.",01 January 2015,"Internet of Things, Smart Spaces, and Next Generation Networks and Systems","Pavel Abakumov,Andrey Koucheryavy","(Saint-Petersburg State University of Telecommunications,Saint Petersburg,Russia)",
Data Aggregation Using Dynamic Tree with Minimum Deformations,https://link.springer.com/chapter/10.1007/978-81-322-2205-7_17,none,conference,Springer,none,"In Wireless Sensor Network, energy efficient routing is a challenging matter. In addition to this the loss of data packets during transmission should be handled carefully. Data aggregation is a technique which can be used to eliminate the unnecessary data or information and transmit only required data to the sink node. To maximize the lifetime of the sensor network, protocols like LEACH, PEGASIS had been proposed, where aggregation of data are done at the cluster head of each cluster and at the sink node. This scheme gives better performance than the conventional protocol of Direct Transmission. In this paper a new scheme has been proposed where the sink node is mobile in nature and the data are forwarded to the sink node through a tree which is constructed on the cluster head of each cluster. To maintain the dynamic structure of the tree during motion of the sink node, a minimum deformation is carried out on the tree so that total energy consumption is less which enhance the life time of the sensor network.",11 December 2014,Computational Intelligence in Data Mining - Volume 1,"Ashis Behera,Madhumita Panda","(Department of Computer Science and Engineering,PKACE,Bargarh,India),(SUIIT,Sambalpur University,Jyotivihar,Burla,768018,India)","India,India"
SEER—An Intelligent Double Tier Fuzzy Framework for the Selection of Cluster Heads Based on Spiritual Energies of Sensor Nodes,https://link.springer.com/chapter/10.1007/978-981-10-8681-6_46,none,conference,Springer,none,"The selection of cluster heads in a wireless sensor network (WSN) is a very challenging area of research. Many algorithms have been proposed for the selection of cluster heads to prolong network lifetime, but maintaining an energy efficient network remains a problem. To overcome this, we propose a new algorithm for cluster head selection based on the Spiritual Energy of the whole WSN, which is known as the SEER (simple energy-efficient reliable) protocol. In addition, the implementation of the double tier fuzzy algorithms on the SEER protocol makes the network more energy efficient. The proposed algorithm has been simulated with MATLAB and compared with the other energy efficient algorithms such as CLERK and LEACH. The results proved to be very promising in terms of the reduction of energy consumption.

",18 September 2018,International Conference on Computer Networks and Communication Technologies,"Maddali M. V. M. Kumar,Aparna Chaparala","(Acharya Nagarjuna University,Guntur,Andhra Pradesh,India),(Department of CSE,RVR & JC College of Engineering,Guntur,Andhra Pradesh,India)","India,India"
Energy Efficient Adaptive Mobile Wireless Sensor Network in Smart Monitoring Applications,https://link.springer.com/chapter/10.1007/978-3-031-23233-6_17,none,conference,Springer,none,"The Mobile Wireless Sensor Networks (MWSNs) owe its name due to mobile sinks or mobile sensor nodes as one category of heterogeneous networks with induced mobility of nodes making it autonomous and more suitable for smart monitoring applications. The possible application in their implementation context in home and disaster management involves the integration of mobile WSN in ubiquitous computing. With the enormous growth of smart devices, the data sharing among entities lead to hotspot problem nearby sink, that requires a powerful computing, communicating and storage capable mobile devices, can benefit network in terms of scalability, efficiency and data delivery speed. In this paper, we proposed an adaptive heterogeneous multi-tiered architecture based mobile sensor network and analyzed its performance and routing efficiency with respect to the static wireless sensor network. The performance metrics used help in validating our proposed method suitable for smart data collecting and dissemination for monitoring applications. Again, the low power wireless personal area network (6LoWPAN) plays a vital role in interconnecting these IoT devices and implementing mobility of nodes with appropriate data rate for robust communication and achieving desired Quality of Service.",01 January 2023,Innovations in Intelligent Computing and Communication,"Seli Mohapatra,Prafulla Kumar Behera,Seli Mohapatra","(Utkal University,Vani Bihar,Bhubaneswar,Odisha,India),(C. V. Raman Global University,Mahura, Bhubaneswar,Odisha,India)","India,India"
Differential Data Processing for Energy Efficiency of Wireless Sensor Networks,https://link.springer.com/chapter/10.1007/978-981-13-9341-9_25,none,conference,Springer,none,"Wireless sensor networks use many types of wireless sensors to configure network. However batteries in wireless sensor nodes are energy limited and consume considerable energy for data transmission. Therefore, data merging is used as a means to increase energy efficiency in data transmission. In this paper, we propose Differential Data Processing (DDP), which reduces the size of data transmitted from the sensor node to increase the energy efficiency of the wireless sensor network. Experimental results show that processing the differential temperature data reduces the average data size of the sensor node by 30%.",04 December 2019,Advances in Computer Science and Ubiquitous Computing,"Kwang Kyu Lim,Byeong Rae Lee,Jin Gon Shon,JiSu Park","(Department of Computer Science,Graduate School,Korea National Open University,Seoul,South Korea),(Division of General Studies,Kyonggi University,Suwon,South Korea)",
Lessons from a Sensor Network Expedition,https://link.springer.com/chapter/10.1007/978-3-540-24606-0_21,172,conference,Springer,none,"Habitat monitoring is an important driving application for wireless sensor networks (WSNs). Although researchers anticipate some challenges arising in the real-world deployments of sensor networks, a number of problems can be discovered only through experience. This paper evaluates a sensor network system described in an earlier work and presents a set of experiences from a four month long deployment on a remote island off the coast of Maine. We present an in-depth analysis of the environmental and node health data. The close integration of WSNs with their environment provides biological data at densities previous impossible; however, we show that the sensor data is also useful for predicting system operation and network failures. Based on over one million data and health readings, we analyze the node and network design and develop network reliability profiles and failure models.",2004,Wireless Sensor Networks,"Robert Szewczyk,Joseph Polastre,David Culler,Alan Mainwaring,David Culler","(University of California,Berkeley,Berkeley,CA,94720,USA),(Intel Research Laboratory at Berkeley,Berkeley,CA,94704,USA)",
Simulation Platforms for Wireless Sensor Networks: How to Select?,https://link.springer.com/chapter/10.1007/978-981-13-7166-0_54,2,conference,Springer,none,"With the fast-track growth of IoT (Internet of Things), wireless sensor networks (WSN) has also gained attention. For effective communication among sensor nodes, protocols are being developed rapidly. Simulation is necessary for any network before deployment to check the functionality and detect the potential errors. Earlier recognition of issues can save both resources and time of network designers. Few simulation environments were already available before the development of WSN technology. Later on, a few other simulation environments were developed specifically for WSN. Simulation environments based on programming language C/C++ and MATLAB are reviewed in this paper. This paper also discusses the extensions of simulation environments. The main focus of this paper is to help novice researchers in choosing an appropriate simulation tool that fits their research criterion.",26 June 2019,Information and Communication Technology for Sustainable Development,"Aarti Kochhar,Pardeep Kaur, Preeti","(Lovely Professional University,Phagwara,India),(University Institute of Engineering and Technology,Panjab University,Chandigarh,India)","India,India"
Enhancing Network Lifespan Longevity Through Optimal Routing in Wireless Sensor Networks,https://link.springer.com/chapter/10.1007/978-981-97-4496-1_27,none,conference,Springer,none,"In the role of addressing the critical challenge as energy imbalance in Sensory Networks, this research study manages the reduction in overall network lifetime caused by uneven energy consumption of nodal points. The existing energy aware approaches that struggle with nodal point replacement difficulties and overlook key network parameters, the proposed system Bat Algorithm integrated with Particle Swarm Optimization (BA-PSO) gives a solution and introduces a density-aware optimal clustering method. This approach ensures reliable data-packet transmission by integrating power balancing and Optimized data-packet Routing for Secured Data Transmission through cluster based network structure. The method linearly enhances the overall lifetime of deployed Sensory Networks by employing a balanced energy conservation technique. Unlike traditional Ant Colony Optimization, the proposed system selects the optimal cluster head to extend the network's lifespan. The work introduces various strategies for optimal edge disjoint routing, utilizing Bat Algorithm integrated with Particle Swarm Optimization to select the best routes. In the Quality of Service parameters, including data reliability, network-processing capacity, network bandwidth, and Power Conservation are considered for optimal selection of routing in Sensor network. By grouping sensor data based on similarity values and grouping them, the proposed system achieves optimal data transmission while efficiently managing power consumption.",01 October 2024,Proceedings of World Conference on Artificial Intelligence: Advances and Applications,"S. Saju,K. Swaminathan,Vijay Ravindran,Ram Prakash Ponraj,P. Delphine Mary,A. Sureshkumar","(Biomedical Engineering,Indra Ganesan College of Engineering,Trichy,India),(Department of ECE,University College of Engineering,Pattukkottai,India),(Department of EEE,Saranathan College of Engineering,Trichy,India),(Department of ECE,M.I.E.T Engineering College,Trichy,India)","India,India,India,India"
A New Fuzzy Clustering Algorithm to Enhance Lifetime of Wireless Sensor Networks,https://link.springer.com/chapter/10.1007/978-3-319-60834-1_8,7,conference,Springer,none,"
Due to limitations of resource in wireless sensor networks (WSNs) enhancing the network lifetime has been of great concern. An efficient routing algorithm is known as clustering algorithm based routing protocol. In which getting optimal cluster heads (CHs) and a number of them has been defiance. In this paper, a new fuzzy clustering algorithm is proposed to maximize the lifetime of WSNs. Network field in this approach, contains two types of sensors: free sensors that communicate directly with sink, and clustered sensors that send the sensed data to the sink through CHs which are preselected. This approach uses fuzzy logic to select free sensor nodes and CHs with four fuzzy parameters. These parameters are energy level of sink and sensor proximity to the sink in terms of free sensors selection, and energy level of sensor node and centrality of sensors in terms of CHs selection. The main goal of our algorithm is to extend the lifetime of WSNs by minimizing distributing the workload on CHs. The simulation results show that our proposed is more efficient than SET protocol.",18 August 2017,Proceedings of the Third International Afro-European Conference for Industrial Advancement — AECIA 2016,"Hassan El Alami,Abdellah Najid","(STRS Laboratory,National Institute of Posts and Telecommunications – INPT,Rabat,Morocco)",Morocco
