title,link,number_of_citation,article_type,publisher,keyword,abstract,publish_date,publication_title,authors,affiliations,countries
Analysis of Attacks on Data Aggregation Protocol in Electronic Communication Technologies,https://link.springer.com/chapter/10.1007/978-3-642-31528-2_1,none,conference,Springer,none,"As a kind of brand-new electronic technology, the data aggregation protocol is confronted with many difficulties by taking safety issues as representative. In this paper, we first analyze the well-known threats against data aggregation in WSNs. In order to study the performance of the common 6 kinds of data aggregation protocols in defending against such attacks, we categorize them into two parts: tree-based and cluster-based data aggregation protocols. On this basis, we compare their performance in defending against these attacks and point out which aspects of them should be improved for higher security.",2013,Advances in Mechanical and Electronic Engineering,"Shuai Fu,Jianfeng Ma,Chang-guang Wang","(School of Computer Science and Technology,Xidian University,Xi’an,710071,China),(College of Information Technology,Hebei Normal University,Shijiazhuang,050016,China)","China,China"
Critical Analysis of Clustering Algorithms for Wireless Sensor Networks,https://link.springer.com/chapter/10.1007/978-981-10-0448-3_65,4,conference,Springer,none,"The scientific and industrial community increased their attention on wireless sensor networks (WSNs) during the past few years. WSNs are used in various critical applications like disaster relief management, combat field reconnaissance, border protection, and security observation. In such applications a huge number of sensors are remotely deployed and have cooperatively worked in unaccompanied environments. The disjoint groups are formed from these sensor nodes and such nonoverlapping groups are known as clusters. Clustering schemes have proven to be effective to support scalability. In this paper, authors have reported a detailed analysis on clustering algorithms and have outlined the clustering schemes in WSNs. We also make a comparative analysis of clustering algorithms on the basis of different parameters like cluster stability, cluster overlapping, convergence time, failure recovery, and support for node mobility. Moreover, we highlight the various issues in clustering of WSNs.",15 March 2016,Proceedings of Fifth International Conference on Soft Computing for Problem Solving,"Santar Pal Singh, Kartik Bhanot, Sugam Sharma","(Electronics and Computer Discipline,DPT,IIT Roorkee,Rookee,247667,India),(ICT Department,MIT,Manipal,576104,Karnatka,India),(Centre for Survey Statistics and Methodology,Iowa State University,Ames,IA,50010,USA)","India,India"
RSCHE: A Virtual Grid Structure Based Routing Scheme with Cell-Header Group Exchanged for Wireless Sensor Network,https://link.springer.com/chapter/10.1007/978-3-319-98776-7_36,1,conference,Springer,none,"In wireless sensor network (WSN), sensor nodes equipped with batteries are randomly deployed to collect massive data. Since nodes’ energy source is usually not rechargeable or replaceable, energy efficiency has always been a chanlleging task for WSN in terms of network lifetime. Among existing works, introducing mobile sinks to WSNs has been considered as an energy efficient way for data collection. Under these circumstance, the network topology becomes dynamic due to sink’s mobility. Consequently, it incurres more communication cost to maintain the routing path and thus decreases the network life time. In this paper, we present a routing scheme with cell-header group exchanged (RSCHE) based on virtual grid structure for WSN. Our method partitions the sensor area into uniform-sized grid cells, in which cell-header is elected to transmit information. Those cell-headers are divided into two groups: Indirect communication cell-header (ICH) group and Direct communication cell-header (DCH) group. Despite their mission of collecting data from cell members, cell-headers in DCH group are also responsible for gathering information from cell-headers which belong to ICH group. Furthermore, we set an exchange time (Exch_t) value for ICH and DCH to optimize the routing path. Simulation results show that our proposed protocol performs better compared with existing works in terms network lifetime and energy consumption.",05 November 2018,International Conference on Applications and Techniques in Cyber Security and Intelligence ATCI 2018,"Jin Wang,Junming Niu,Xiang Yin,Kai Wang,Jin Wang","(School of Information Engineering,Yangzhou University,Yangzhou,China),(School of Computer and Communication Engineering,Changsha University of Science and Technology,Changsha,China)","China,China"
Spectrum Sensing Based Heed Routing Performance Enhancement Strategy for Cognitive Radio Sensor Networks,https://link.springer.com/chapter/10.1007/978-981-10-7635-0_6,1,conference,Springer,none,"The paper formulates the cluster based (Hybrid Energy Efficient Distribution) HEED routing strategy for cognitive radio sensor networks (CRSN) using the principles of spectrum sensing. The theory of spectrum sensing enables the secondary users to effectively use the vacant channels and ensure a sense of protection for the primary users. Though heterogeneous co-operative spectrum sensing periodically increases the throughput of the network, still it necessitates measures for improving the other performance indices. The focus relates to reducing the spectrum sensing duration with a view of maximizing the time for data transmission. The attempts reiterate to extract an efficient solution through hybrid sequential and parallel channel sensing (CS) technique for routing the information. The efforts bring out the benefits in terms of the parameters that include throughput, energy, packet loss, delay and overhead through a comparative study with CS- LEACH and CS-AODV routing schemes. The results obtained in the NS2 platform allow it to claim a place for the use of CS-HEED in real world applications.",17 December 2017,Smart Secure Systems – IoT and Analytics Perspective,"S. Janani,M. Ramaswamy,J. Samuel Manoharan","(Department of ECE,A. V. C College of Engineering,Mannampandal,Mayiladuthurai,609305,Tamil Nadu,India),(Department of Electrical Engineering,Annamalai University,Annamalai Nagar,Chidambaram,608002,Tamil Nadu,India),(Department of ECE,Bharathiyar College of Engineering and Technology,Karaikal,609609,Tamil Nadu,India)","India,India,India"
Swarm Intelligence Based Data Aggregation for Intruder Detection in Wireless Sensor Networks,https://link.springer.com/chapter/10.1007/978-3-319-21009-4_44,none,conference,Springer,none,"Wireless Sensor Network in which nodes are mobile can be defined as MWSN (Mobile Wireless Sensor Networks). MWSNs are a budding field of research in contrast to their well-established ancestor. It consists of a variety of sensing elements deployed indiscriminately and at enormous scale. This can build a huge variety of redundant sensory information. Transmission of such redundant data saturates network resources and it additionally consumes nodes energy. Data aggregation is the process of reducing the amount of packets to be sent to sink to increase the life time of MWSN. Path and location of the nodes are changing frequently in mobile WSN. So Swarm intelligence (group behaviour) is needed for the communication as well as on data collection, Query publication and intrusion detection. To operate MWSNs in a secure way, intrusions should be detected before attackers can harm the network. Intrusion can also occur in multiple layers of MWSN so continuous investigation of aggregated data to be needed. Proposed work is for SIDI (Swarm Intelligence based Data aggregation for Intruder detection) raising the energy efficiency of a network. Simulation results indicate that this operation practically will increase the network lifetime.",01 January 2015,Knowledge Management in Organizations,"Muthuraman Thangaraj,Pichaiah Punitha Ponmalar","(Department of Computer Science,Madurai Kamaraj University,Madurai,India),(Department of Computer Science,Sri Meenakshi Govt Arts College,Madurai,India)","India,India"
Game Theory Based Cluster Formation Protocol for Localized Sensor Nodes in Wireless Sensor Network (GCPL),https://link.springer.com/chapter/10.1007/978-981-15-7533-4_42,none,conference,Springer,none,"Wireless Sensor Networks (WSNs) are collection of a large number of randomly distributed sensor nodes, which are integrated with individual electro-mechanical system (MEMS). Sensor nodes use the MEMS to interact with the physical environment and extract data regarding events. The random deployment of sensor nodes makes it difficult for the sink node to identify the geographical location of those nodes without GPS connection. The use of GPS for all nodes raises the cost of network deployment. The proposed scheme (GCPL) detects the geographical location of sensor nodes without using GPS. Energy conservation is another important issue in WSN for energy constraint of sensor nodes. Clustering is a well-known technique to reduce energy dissipation in an effective way and increase network life time. In WSN, selection of cluster head is very difficult as in cluster heads energy depletes quickly due to their extra responsibilities. The early break down of cluster heads force to choose new cluster head regularly which leads to decrease of network lifetime. The proposed scheme applies game theory-based clustering technique, in which all sensors declare its own strategy to become a cluster head (CH) or not. The simulation result reveals that GCPL efficiency is increased by contrast with CROSS, LGCA, and HGTD.",20 February 2021,"Proceedings of the International Conference on Paradigms of Computing, Communication and Data Sciences","Raj Vikram,Sonal Kumar,Ditipriya Sinha,Ayan Kumar Das","(Department of Computer Science and Engineering,National Institute of Technology Patna,Patna,India),(Department of Computer Science and Engineering,Birla Institute of Technology,Patna,India)","India,India"
Lifespan-Aware Routing for Wireless Sensor Networks,https://link.springer.com/chapter/10.1007/978-3-642-13541-5_8,2,conference,Springer,none,Wireless Sensor Networks (WSNs) have the capability to become the eyes and ears for the future networked society allowing monitoring of any habitat or object’s properties remotely and independently of an energy source. Services based on this technology may change the way we monitor and control remote areas and objects.In this paper we propose a different approach to routing data across Wireless Sensor Networks. We argue that a distance-vector protocol using a lifespan-aware metric is a plausible solution to the task of routing information in WSN in a manner that both saves energy of the individual node and manages summarized energy of the system equally and fairly. The concept is designed to handle heterogeneous WSNs with different hardware and battery capacities while retaining a true peer-to-peer network topology.,2010,Agent and Multi-Agent Systems: Technologies and Applications,"Adam Czubak,Jakub Wojtanowski","(Institute of Mathematics and Computer Science,Opole University, )",
Retrospective Analysis of Wireless Body Area Network,https://link.springer.com/chapter/10.1007/978-3-030-33846-6_56,none,conference,Springer,none,"Wireless Body Area Networks (WBANs) plays a key role in monitoring patient-health in order to gain a remarkable interest among the researchers. A WBAN consists of devices which are both small and fixed in the human body or kept as a device which can be easily carried by a person externally. The patient health can be observed and monitored consistently. It can also send the report on the status of patient health to the doctor and care taker. This paper discuss about energy efficiency in WBAN. Later report on various protocols proposed by several authors is compared in terms of its limitations, advantages and disadvantages. Finally the issues that can be encountered while implementing a protocol for WBAN are analyzed.",03 November 2019,Inventive Computation Technologies,"A. Angel Cerli,K. Kalaiselvi","(Vels Institute of Science,Technology & Advanced Studies (VISTAS),Pallavaram,Chennai,600117,India)",India
DFDM: Decentralized Fault Detection Mechanism to Improving Fault Management in Wireless Sensor Networks,https://link.springer.com/chapter/10.1007/978-3-642-21984-9_56,6,conference,Springer,none,"Wireless Sensor networks (WSN) are inherently fault-prone due to the shared wireless communication medium and harsh environments in which they are deployed. Energy is one of the most constraining factors and node failures due to crash and energy exhaustion are commonplace. In order to avoid degradation of service due to faults, it is necessary for the WSN to be able to detect faults early and initiate recovery actions. In this paper we propose a decentralized cluster based method for fault detection and recovery which is energy efficient namely DFDM. Simulation Results show that the performance of proposed algorithm is more efficient than previous ones.",2011,Digital Information and Communication Technology and Its Applications,"Shahram Babaie,Ali Ranjideh Rezaie,Saeed Rasouli Heikalabad","(Department of Computer Engineering,Tabriz Branch,Islamic Azad University,Tabriz,Iran)",
DEEC Protocol with ACO Based Cluster Head Selection in Wireless Sensor Network,https://link.springer.com/chapter/10.1007/978-3-031-40564-8_4,none,conference,Springer,none,"When it comes to wireless sensor networks, the routing protocols have a major bearing on the network’s power consumption, lifespan, and other metrics. Cost-based, chaining, and clustering models are just a few of the many that inform the creation of routing protocols. It can be challenging to keep track of all of the nodes in Wireless Sensor Networks because there are so many of them. The optimal strategy is to form a cluster out of several nodes. By grouping together, sensor nodes are able to conserve energy and reduce their overall impact on the network. Management and coordination of the cluster’s nodes are performed by the cluster head. In its current configuration, the DEEC functions well during transmissions and has been around for some time in the network. However, a probability strategy based on ACO is used in this research to determine which node within a cluster will serve as the cluster’s leader. It is the responsibility of the cluster head to collect data from each of the individual nodes and then transmit that data to the home station. The ACO-DEEC protocol chooses a leader for the cluster by putting a probability rule that is based on the parameters of the distance between the nodes and the quantity of power they have. As a consequence of this, this algorithm performs better than the conventional DEEC protocol in terms of energy efficiency, the number of packets reached at the base station, and the count of the nodes that fail entirely.",08 August 2023,"Computing Science, Communication and Security","Renu Jangra,Ramesh Kait","(University of Engineering and Management,Jaipur,Rajasthan,India),(Kurukshetra University,Kurukshetra,Haryana,India)","India,India"
Optimal Shortest Path Routing over Wireless Sensor Networks Using Constrained Genetic Firefly Optimization Algorithm,https://link.springer.com/chapter/10.1007/978-981-19-9225-4_47,none,conference,Springer,none,"In Wireless Sensor Networks (WSNs), a large number of sensor nodes are placed over a specific area in any real-life application. The sensor node is small, with limited battery life, memory, and computing capacity. Due to the limited power of the battery, WSNs must expand the system life by minimizing the energy usage. In the existing system, the methods have limitations related to optimal shortest routing path, node energy consumption, network reconfiguration, and so on. In order to overcome these issues, a Constrained Genetic FireFly Optimization Algorithm (CGFFOA) is proposed. The CGFFOA algorithm is designed to select the best shortest path routing through the selection of Cluster Head (CH) nodes based on the better energy utilization, delay, and high throughput sensor nodes. It is used to optimize the routing path based on the energy, hop count, inter and intra cluster delay, and lifetime. The simulation findings therefore conclude that, with regard to reduced energy consumption, higher throughput, and lower end-to-end delay, the proposed CGFFOA algorithm is preferable to existing methods such as Particle Swarm Optimization (PSO) and Dynamic Source Routing (DSR).",12 March 2023,Third Congress on Intelligent Systems,"Sujatha Arun Kokatnoor,Vandana Reddy,Balachandran Krishnan","(Department of Computer Science and Engineering,School of Engineering and Technology,CHRIST (Deemed to be University),Bangalore,Karnataka,India)",India
Routing and Data Aggregation Techniques in Wireless Sensor Networks: Previous Research and Future Scope,https://link.springer.com/chapter/10.1007/978-981-99-5435-3_51,3,conference,Springer,none,"Wireless sensor networks (WSNs) consist of a small-sized large number of sensor nodes. The primary task of these sensor nodes is to sense the required event in a specific area of interest. The sensor nodes can be installed in areas where it is difficult for human beings to reach easily. WSNs have a huge number of applications such as agriculture monitoring, habitat monitoring, healthcare monitoring, volcanic erupted areas, security, and battlefield. As the sensor nodes are very small in size, they come up with very limited capability for processing the data. The power backup for the sensor nodes is very less due to which the sensors drain out at a very high speed. Draining of sensor nodes decreases the lifetime of the sensor network, so the network failure rate is very high in WSNs. The sensor nodes are generally close to each other, and because of that, they sense redundant data from the environment. To avoid forwarding redundant data to the base station, various routing and data aggregation techniques are used. Data aggregation is one of the very effective energy-efficient techniques used in WSNs. This technique helps in removing redundant data from the sensed data. This research paper will discuss various data aggregation techniques used in WSNs.",03 January 2024,Data Science and Communication,"Navjyot Kaur,D. Vetrithangam","(Department of Computer Science and Engineering,Chandigarh University,Mohali,Punjab,India)",India
Clusterhead Selection Using Multiple Attribute Decision Making (MADM) Approach in Wireless Sensor Networks,https://link.springer.com/chapter/10.1007/978-3-642-37949-9_12,6,conference,Springer,none,"Cluster head (CH) plays an important role in aggregating and forwarding data in a wireless sensor networks (WSNs). The major challenge in WSNs is an appropriate selection of cluster heads for gathering data from nodes. In this paper, we present a multi-criterion approach for the selection of cluster heads (CHs) using Technique for Order Preference by Similarity to Ideal Solution (TOPSIS). Three attributes are considered for the selection of CHs, namely residual energy, number of neighbors and distance from the base station. The simulation results demonstrate that the present approach is more effective than another Low-energy Adaptive Cluster Hierarchy (LEACH) protocol in prolonging the network lifetime.",2013,"Quality, Reliability, Security and Robustness in Heterogeneous Networks","Puneet Azad,Puneet Azad,Vidushi Sharma","(Department of Electronics & Communication,Maharaja Surajmal Institute of Technology,C-4,Janak Puri,New Delhi,110058,India),(School of Information & Communication Technology,Gautam Buddha University,Yamuna Expressway,Greater Noida,Gautam Budh Nagar,Uttar Pradesh,201308,India)","India,India"
A Multi-agent Approach to Energy-Aware Wireless Sensor Networks Organization,https://link.springer.com/chapter/10.1007/978-3-642-39860-5_4,3,conference,Springer,none,"Wireless Sensor Networks when deployed in inaccessible or remote areas require sensing and communication algorithms that minimise energy consumption. This is needed to reduce battery replacement costs. At the same time, the information transmitted to the sink has to be good enough in order to make timely decisions on the environmental hazards being monitored. Sensor algorithms have to thus balance quality of information with energy consumption. We introduce in this paper an algorithm that uses multiagent co-ordination technology to organize the sensors in coalitions that share the burden of sensing and communicating. We provide experimental evidence of a good balance between information quality and energy consumption on a simulated river pollution phenomenon.",2013,Agreement Technologies,"M. del Carmen Delgado-Roman,Carles Sierra","(Artificial Intelligence Research Institute (IIIA),Spanish Scientific Research Council (CSIC),Universitat Autònoma de Barcelona,Bellatera,E08193,Barcelona,Spain)",Spain
An Improved Energy-Aware Secure Clustering Technique for Wireless Sensor Network,https://link.springer.com/chapter/10.1007/978-981-33-4788-5_2,none,conference,Springer,none,"With the recent advancements in technology, nowadays wireless sensor networks are the most prominent networks deployed almost in all the areas such as healthcare, agriculture, defense, etc. Wireless sensor nodes are basically used to monitor and send the data to a central machine for analysis purposes. The major concern while deploying the wireless sensor network is the limited computational resources and battery-operated tiny sensor nodes. Hence, the organization of the network must take into account these constraints. This chapter proposes a novel clustering algorithm which works on different variables that select the most prominent node as a Cluster Head. Due to the changes in the underlying network, Type 2 fuzzy logic system is used in the clustering to generate the rule base to develop a feasible system. The size of the cluster is unequal as according to the survey, the unequal distribution of nodes consumes less energy as compared to equal distribution. The results of the simulation show that the proposed system prolongs the lifespan of the network.",23 March 2021,"Proceedings of International Conference on Big Data, Machine Learning and Applications","Simran R. Khiani,V. M. Thakare,Simran R. Khiani,C. G. Dethe","(SGBAU,Amravati,India),(GHRCEM,Pune,India),(UGC Academic Staff College,Nagpur,India)","India,India,India"
Multi-stage Clustering Algorithm for Energy Optimization in Wireless Sensor Networks,https://link.springer.com/chapter/10.1007/978-981-15-0399-3_18,7,conference,Springer,none,"
Clustering technique is one of the approach to optimize energy consumption, balance load and increase lifetime of networks in wireless sensor network (WSN). In this paper, a novel multi-stage clustering algorithm is proposed for heterogeneous energy environment. The proposed multi-stage approach combines the behaviour of a bird and the distributed energy efficient model. The behaviour of the bird is expressed in the form of mathematical expression and then translated into an algorithm. The algorithm is then combined with the distributed energy efficient model to ensure efficient energy optimization. The proposed multi-stage clustering algorithm (referred to as DEEC-KSA) is evaluated through simulation and compared with benchmarked clustering algorithms. The result of simulation showed that the performance of DEEC-KSA is efficient among the comparative clustering algorithms for energy optimization in terms of stability period, network lifetime and network throughput. Additionally, the proposed DEEC-KSA has the optimal network running time (in seconds) to send higher number of packets to base station successfully.
",24 September 2019,Soft Computing in Data Science,"Israel Edem Agbehadji,Richard C. Millham,Abdultaofeek Abayomi,Simon James Fong,Jason J. Jung,Khac-Hoai Nam Bui","(ICT and Society Research Group,Department of Information Technology,Durban University of Technology,Durban,South Africa),(ICT and Society Research Group,Department of Computer and Information Science,University of Macau/Durban University of Technology,Taipa,Macau SAR),(Chung-Ang University,Seoul,South Korea),(Korea Institute of Science and Technology Information,Daejeon,South Korea)",South Africa
Low-Latency Routing for Energy-Harvesting Sensor Networks,https://link.springer.com/chapter/10.1007/978-3-540-73549-6_42,1,conference,Springer,none,"This paper presents low-latency routing strategies that take account of energy-harvesting sensor nodes in wireless sensor networks. Currently, in the case of tree-based network connectivity, ‘lazy’ nodes with a long interval between computational activities may slow down communication if deployed along a routing path. To cope with this problem, we suggest a random graph in which a node may have multiple parent nodes, thus allowing a choice of path to the sink node. We also propose three path selection schemes for the network topology on the basis of (a) the cost of a single hop from the current node, (b) the cost of two hops, and (c) the cost of a single hop plus a cost estimate for the remainder of the path to the sink, respectively. The proposed strategies are shown to outperform the existing routing algorithm for a tree-structured energy-harvesting sensor network.",2007,Ubiquitous Intelligence and Computing,"Hyuntaek Kwon,Donggeon Noh,Junu Kim,Joonho Lee,Dongeun Lee,Heonshik Shin","(School of Computer Science and Engineering,Seoul National University,Sillim-dong,Gwanak-gu,Seoul 151-744,Korea)",
